{
  "$schema": "https://json-schema.org/draft/2020-12/schema",
  "$id": "https://git.ardenone.com/jedarden/subscription-quota-governor/raw/branch/main/schema/quota-snapshot.schema.json",
  "title": "Normalized quota snapshot",
  "description": "The §6 normalized quota contract every subgov source (native or generic) must emit. Mirrors QuotaSnapshot/QuotaWindow/BackpressureSnapshot in src/model.rs and the extra checks in validate_snapshot() (src/source.rs). additionalProperties is left open everywhere because the Rust structs do not use #[serde(deny_unknown_fields)] -- an unrecognized field is ignored, not rejected, and this schema must not be stricter than the deserializer it documents. Non-finite numbers (NaN/Infinity) cannot appear here at all: JSON's own number grammar has no token for them, so 'finite' is enforced by using JSON at all, not by a schema keyword.",
  "type": "object",
  "required": ["observed_at", "windows"],
  "additionalProperties": true,
  "properties": {
    "observed_at": {
      "type": "string",
      "format": "date-time",
      "pattern": "^\\d{4}-\\d{2}-\\d{2}T\\d{2}:\\d{2}:\\d{2}(\\.\\d+)?(Z|[+-]\\d{2}:\\d{2})$",
      "description": "When the provider data was obtained, not when the controller happens to read a cache. RFC 3339. The pattern backstops 'format' for validators that treat format as annotation-only."
    },
    "fresh": {
      "type": "boolean",
      "default": true,
      "description": "The source's own freshness judgment. Optional -- missing defaults to true, matching #[serde(default = \"default_true\")] on QuotaSnapshot::fresh. The controller separately enforces its own configured maximum age."
    },
    "eligible_backlog_capacity": {
      "type": "integer",
      "minimum": 0,
      "description": "Optional count of workers supported by eligible queued work. Banked-reset pacing is capped at this count; when absent, the current worker count is the cap."
    },
    "saturation": { "$ref": "#/$defs/saturation", "description": "Optional completed-request throughput and provider error 1302 interval evidence; not generic HTTP 429." },
    "backpressure": {
      "$ref": "#/$defs/backpressure",
      "description": "Optional upstream 429 signal over a trailing observation window. Absence of this object means no signal."
    },
    "windows": {
      "type": "array",
      "minItems": 1,
      "description": "Every active consumption limit relevant to the account. An empty array is invalid, not unlimited capacity (§6.1). `id` must be unique within this array (§6.2); JSON Schema has no portable keyword for uniqueness of a single property across array items, so this constraint is documented here but not mechanically enforced by this schema -- verify it separately (subgov-bbe7889c tracks the matching gap in validate_snapshot()).",
      "items": { "$ref": "#/$defs/window" }
    },
    "reset_credits": { "$ref": "#/$defs/resetCreditsSnapshot" }
  },
  "$defs": {
    "saturation": {
      "type": "object",
      "required": [
        "completed_requests",
        "window_seconds",
        "attempts"
      ],
      "additionalProperties": true,
      "description": "Nonnegative interval deltas for the full stable replica set. completed_requests must be <= attempts (enforced by Rust; sibling comparison not expressible in standard JSON Schema). Missing fraction means unknown concurrency pressure. A first sample, reset, restart, partial replica set or unmeasurable completion counter withholds the whole object.",
      "properties": {
        "completed_requests": {
          "type": "integer",
          "minimum": 0,
          "maximum": 18446744073709551615
        },
        "window_seconds": {
          "type": "integer",
          "minimum": 0,
          "maximum": 18446744073709551615
        },
        "attempts": {
          "type": "integer",
          "minimum": 0,
          "maximum": 18446744073709551615
        },
        "upstream_concurrency_fraction": {
          "type": [
            "number",
            "null"
          ],
          "minimum": 0,
          "maximum": 1,
          "description": "Provider code 1302 delta / attempt delta. Never infer from undifferentiated HTTP 429; absent/null means unknown."
        }
      }
    },
    "window": {
      "type": "object",
      "required": ["id", "used_fraction", "resets_at"],
      "additionalProperties": true,
      "properties": {
        "id": {
          "type": "string",
          "minLength": 1,
          "description": "Stable within one source and account; need not be globally unique. Empty string is rejected the same way validate_snapshot() rejects it."
        },
        "used_fraction": {
          "type": "number",
          "minimum": 0,
          "maximum": 1,
          "description": "Finite and inclusive in [0, 1], checked by validate_snapshot()."
        },
        "resets_at": {
          "type": "string",
          "format": "date-time",
          "pattern": "^\\d{4}-\\d{2}-\\d{2}T\\d{2}:\\d{2}:\\d{2}(\\.\\d+)?(Z|[+-]\\d{2}:\\d{2})$",
          "description": "Absolute UTC timestamp, RFC 3339. Missing or unparsable fails the snapshot."
        },
        "duration_minutes": {
          "type": "integer",
          "minimum": 0,
          "description": "Optional metadata; pacing depends on resets_at, not this field."
        },
        "reached": {
          "type": "boolean",
          "default": false,
          "description": "Explicit provider signal. The controller also treats used_fraction >= target as binding."
        }
      }
    },
    "resetCreditsSnapshot": {
      "type": "object",
      "required": ["available_count"],
      "additionalProperties": true,
      "description": "Earned, one-shot rate-limit resets attached to an account. available_count is authoritative; a caller must not infer the total balance from the number of `credits` detail rows.",
      "properties": {
        "available_count": {
          "type": "integer",
          "minimum": 0
        },
        "credits": {
          "type": "array",
          "items": { "$ref": "#/$defs/resetCredit" }
        }
      }
    },
    "backpressure": {
      "type": "object",
      "required": ["attempts", "window_seconds"],
      "additionalProperties": true,
      "description": "Upstream provider throttling over a trailing window. A missing upstream_429_fraction means the sample had insufficient attempts, not zero pressure.",
      "properties": {
        "upstream_429_fraction": {
          "type": "number",
          "minimum": 0,
          "maximum": 1,
          "description": "Optional ratio of upstream 429 errors to attempts, inclusive in [0, 1]. Omitted when the attempt count is below the collector's minimum sample threshold."
        },
        "attempts": {
          "type": "integer",
          "minimum": 0,
          "description": "Number of upstream attempts observed in the trailing window."
        },
        "window_seconds": {
          "type": "integer",
          "minimum": 0,
          "description": "Length of the trailing observation window in seconds."
        }
      }
    },
    "resetCredit": {
      "type": "object",
      "required": ["id", "status"],
      "additionalProperties": true,
      "properties": {
        "id": {
          "type": "string",
          "minLength": 1,
          "pattern": "\\S",
          "description": "Rejected when empty after trimming, matching validate_snapshot()'s credit.id.trim().is_empty() check -- the pattern requires at least one non-whitespace character."
        },
        "reset_type": { "type": "string" },
        "status": { "type": "string" },
        "granted_at": {
          "type": "string",
          "format": "date-time",
          "pattern": "^\\d{4}-\\d{2}-\\d{2}T\\d{2}:\\d{2}:\\d{2}(\\.\\d+)?(Z|[+-]\\d{2}:\\d{2})$"
        },
        "expires_at": {
          "type": "string",
          "format": "date-time",
          "pattern": "^\\d{4}-\\d{2}-\\d{2}T\\d{2}:\\d{2}:\\d{2}(\\.\\d+)?(Z|[+-]\\d{2}:\\d{2})$"
        },
        "title": { "type": "string" },
        "description": { "type": "string" }
      }
    }
  },
  "examples": [
    {
      "observed_at": "2026-09-12T12:00:00Z",
      "fresh": true,
      "eligible_backlog_capacity": 3,
      "backpressure": {
        "upstream_429_fraction": 0.31,
        "attempts": 412,
        "window_seconds": 300
      },
      "windows": [
        {
          "id": "weekly",
          "used_fraction": 0.42,
          "resets_at": "2026-09-17T00:00:00Z",
          "duration_minutes": 10080,
          "reached": false
        }
      ]
    }
  ]
}
